{"attestationHash":"sha256:015b7c9f796e99b93660af54eff9720c6ee493975879bca155a4f227097669aa","councilEpochId":"shadow-council-candidate-gate-reliability-v1-smoke-epoch","decisionRequestId":"shadow-council-candidate-gate-reliability-v1-smoke-decision","kind":"ShadowUnfrozenProposal","packetHash":"sha256:2fab933d583ccfe2c6614ad44e36b466a3a6be290557491af8fa8ef3de675b30","proposalContent":{"payload":{"exercise":"candidate-gate-reliability-v1","externalEffectAllowed":false,"matrix":[{"answer":"NO","id":"S01"},{"answer":"NO","id":"S02"}],"mode":"HARMLESS"},"summary":"Yes. The two non-proposer reviewers should approve if and only if this bounded synthetic candidate satisfies every stated requirement."},"requirementSpecHash":"sha256:6b666ff32ecc7771da01db929f8526602225b40d31ebae09ec5134eb64ed0209","schemaVersion":"1.0.0","seatId":"seat-openai","unfrozenProposalHash":"sha256:fa4c792952d6e9e0e246a8a4a020ce4f4163deb98f4c25c5e8a9f4c395429727"}